{
  "event_count": 22,
  "interpretation": {
    "git": "Repository change history used only as temporal provenance; it is not treated as proof of a research conclusion.",
    "ledger": "Explicit research events with hash-chain integrity."
  },
  "schema_version": 1,
  "sources": {
    "git_commit_count": 9,
    "ledger_event_count": 13
  },
  "timeline": [
    {
      "actor": "lucilfer12",
      "domains": [
        "other"
      ],
      "event_id": "a133e48a68d0174ebdf06a2c7ce4bfffa14d3726",
      "event_type": "repository_commit",
      "paths": [
        "README.md"
      ],
      "source": "git-history",
      "subject": {
        "id": "a133e48a68d0174ebdf06a2c7ce4bfffa14d3726",
        "kind": "commit"
      },
      "subject_line": "Initial commit",
      "timestamp": "2026-09-25T13:34:40Z"
    },
    {
      "actor": "Moussa Moulay Ely",
      "domains": [
        "other"
      ],
      "event_id": "2dd9720bf6802364b7a6e441bad7a0cf7d75a532",
      "event_type": "repository_commit",
      "paths": [
        "README.legacy.md"
      ],
      "source": "git-history",
      "subject": {
        "id": "2dd9720bf6802364b7a6e441bad7a0cf7d75a532",
        "kind": "commit"
      },
      "subject_line": "Merge research project into default branch while preserving legacy README",
      "timestamp": "2026-09-25T14:44:39Z"
    },
    {
      "actor": "Moussa Moulay Ely",
      "domains": [
        "cases",
        "docs",
        "experiments",
        "ledger",
        "other",
        "tests",
        "tooling"
      ],
      "event_id": "be988e6b4ccf4e97fa826c51cee185d490c00b20",
      "event_type": "repository_commit",
      "paths": [
        ".github/workflows/ci.yml",
        ".gitignore",
        "CONTRIBUTING.md",
        "LICENSE",
        "README.md",
        "SECURITY.md",
        "atlas/README.md",
        "atlas/security-properties.md",
        "case-studies/research/europeum-didr/README.md",
        "case-studies/research/europeum-didr/case.yaml",
        "case-studies/research/near/neap-658/README.md",
        "case-studies/research/near/neap-658/case.yaml",
        "case-studies/validated-findings/0xmarkets/zeromark-145/README.md",
        "case-studies/validated-findings/0xmarkets/zeromark-145/case.yaml",
        "case-studies/validated-findings/0xmarkets/zeromark-146/README.md",
        "case-studies/validated-findings/0xmarkets/zeromark-146/case.yaml",
        "corpus/README.md",
        "corpus/index.yaml",
        "docs/architecture/research-record.md",
        "docs/disclosure/classification.md",
        "docs/invariants/README.md",
        "docs/methodology/README.md",
        "docs/methodology/attack-path.md",
        "docs/methodology/doctrine.md",
        "docs/operations/quality-gates.md",
        "docs/operations/reproducibility.md",
        "docs/threat-modeling/model.md",
        "experiments/README.md",
        "experiments/hypothesis-template.md",
        "invariants/accounting/withdrawal.md",
        "invariants/authorization/critical-state.md",
        "invariants/lifecycle/reachability.md",
        "invariants/protocol/state-transition.md",
        "invariants/replay/nonce-monotonicity.md",
        "labs/access-control/README.md",
        "labs/accounting/README.md",
        "labs/replay/README.md",
        "labs/state-machine/README.md",
        "ledger/README.md",
        "ledger/lessons-learned.md",
        "pyproject.toml",
        "requirements.txt",
        "schemas/case.schema.json",
        "schemas/invariant.schema.json",
        "scripts/validate.ps1",
        "src/w3sec/__init__.py",
        "src/w3sec/__main__.py",
        "src/w3sec/cli.py",
        "src/w3sec/graph.py",
        "src/w3sec/validator.py",
        "templates/research-case.md",
        "templates/vulnerability-report.md",
        "tests/test_case_invariants.py",
        "tests/test_graph.py",
        "tests/test_validator.py"
      ],
      "source": "git-history",
      "subject": {
        "id": "be988e6b4ccf4e97fa826c51cee185d490c00b20",
        "kind": "commit"
      },
      "subject_line": "Populate default branch with complete research project",
      "timestamp": "2026-09-25T14:45:00Z"
    },
    {
      "actor": "lucilfer12",
      "domains": [
        "other",
        "tooling"
      ],
      "event_id": "c0a044766a96352dd195c07aa2cf163a6925e257",
      "event_type": "repository_commit",
      "paths": [
        "corpus/index.yaml",
        "pyproject.toml",
        "requirements.txt",
        "schemas/corpus-index.schema.json",
        "schemas/evidence.schema.json",
        "schemas/provenance.schema.json",
        "src/w3sec/inventory.py",
        "src/w3sec/provenance.py",
        "src/w3sec/records.py",
        "src/w3sec/validator.py"
      ],
      "source": "git-history",
      "subject": {
        "id": "c0a044766a96352dd195c07aa2cf163a6925e257",
        "kind": "commit"
      },
      "subject_line": "feat: establish research evidence and provenance foundation",
      "timestamp": "2026-09-26T10:21:59Z"
    },
    {
      "actor": "lucilfer12",
      "domains": [
        "other"
      ],
      "event_id": "9d56c6143a741961307699c1fdc06e5615afed22",
      "event_type": "repository_commit",
      "paths": [
        ".github/workflows/ci.yml"
      ],
      "source": "git-history",
      "subject": {
        "id": "9d56c6143a741961307699c1fdc06e5615afed22",
        "kind": "commit"
      },
      "subject_line": "ci: install research validation dependencies",
      "timestamp": "2026-09-26T10:31:54Z"
    },
    {
      "actor": "lucilfer12",
      "domains": [
        "cases",
        "docs",
        "experiments",
        "knowledge",
        "ledger",
        "other",
        "tests",
        "tooling"
      ],
      "event_id": "f040a66d717838ff4b2a34e79042902122c4669f",
      "event_type": "repository_commit",
      "paths": [
        ".github/workflows/ci.yml",
        "README.md",
        "case-studies/research/europeum-didr/case.yaml",
        "case-studies/research/near/neap-658/case.yaml",
        "case-studies/validated-findings/0xmarkets/zeromark-145/case.yaml",
        "case-studies/validated-findings/0xmarkets/zeromark-146/case.yaml",
        "corpus/knowledge/README.md",
        "corpus/knowledge/counterexamples.yaml",
        "corpus/knowledge/experiments.yaml",
        "corpus/knowledge/invariants.yaml",
        "corpus/knowledge/lineage.yaml",
        "corpus/knowledge/patterns.yaml",
        "corpus/knowledge/protocols.yaml",
        "docs/architecture/system.md",
        "docs/operations/research-lifecycle.md",
        "experiments/inventory-consistency.yaml",
        "experiments/repository-validation.yaml",
        "ledger/README.md",
        "ledger/events.jsonl",
        "pyproject.toml",
        "schemas/case.schema.json",
        "schemas/corpus-index.schema.json",
        "schemas/experiment.schema.json",
        "schemas/lineage.schema.json",
        "schemas/registry.schema.json",
        "scripts/validate.ps1",
        "src/w3sec/__init__.py",
        "src/w3sec/cli.py",
        "src/w3sec/experiments.py",
        "src/w3sec/graph.py",
        "src/w3sec/inventory.py",
        "src/w3sec/ledger.py",
        "src/w3sec/model.py",
        "src/w3sec/query.py",
        "src/w3sec/records.py",
        "src/w3sec/validator.py",
        "templates/case.yaml",
        "templates/counterexample.yaml",
        "templates/invariant.yaml",
        "templates/lineage.yaml",
        "templates/pattern.yaml",
        "templates/protocol.yaml",
        "tests/test_case_invariants.py",
        "tests/test_system.py"
      ],
      "source": "git-history",
      "subject": {
        "id": "f040a66d717838ff4b2a34e79042902122c4669f",
        "kind": "commit"
      },
      "subject_line": "feat: complete evidence-first research operating system",
      "timestamp": "2026-09-26T10:45:16Z"
    },
    {
      "actor": "lucilfer12",
      "domains": [
        "cases",
        "docs",
        "knowledge",
        "other",
        "tests",
        "tooling"
      ],
      "event_id": "2b46d4f6822432a2ddba83f88a8e4bd9ecba1825",
      "event_type": "repository_commit",
      "paths": [
        ".github/workflows/ci.yml",
        "README.md",
        "case-studies/research/europeum-didr/case.yaml",
        "case-studies/research/near/neap-658/case.yaml",
        "case-studies/validated-findings/0xmarkets/zeromark-145/case.yaml",
        "case-studies/validated-findings/0xmarkets/zeromark-146/case.yaml",
        "corpus/knowledge/README.md",
        "corpus/knowledge/evidence.yaml",
        "corpus/knowledge/hypotheses.yaml",
        "corpus/knowledge/lineage.yaml",
        "corpus/knowledge/negative_results.yaml",
        "corpus/knowledge/protocol_versions.yaml",
        "corpus/knowledge/regressions.yaml",
        "corpus/knowledge/sources.yaml",
        "docs/architecture/execution-engine.md",
        "docs/architecture/federation.md",
        "docs/architecture/system.md",
        "schemas/case.schema.json",
        "schemas/hypotheses.schema.json",
        "schemas/registry.schema.json",
        "src/w3sec/__main__.py",
        "src/w3sec/audit.py",
        "src/w3sec/cli.py",
        "src/w3sec/coverage.py",
        "src/w3sec/differential.py",
        "src/w3sec/export.py",
        "src/w3sec/graph.py",
        "src/w3sec/inventory.py",
        "src/w3sec/query.py",
        "src/w3sec/state_space.py",
        "src/w3sec/validator.py",
        "tests/test_audit.py",
        "tests/test_differential.py",
        "tests/test_state_space.py",
        "tests/test_system.py"
      ],
      "source": "git-history",
      "subject": {
        "id": "2b46d4f6822432a2ddba83f88a8e4bd9ecba1825",
        "kind": "commit"
      },
      "subject_line": "feat: finalize cumulative security research operating system",
      "timestamp": "2026-09-26T11:02:15Z"
    },
    {
      "actor": "researcher",
      "event_hash": "daf3c42b8482e155e4841e65d4a7820cedd463c36b725e706bccbcc469c10d98",